{"type":"config","name":"bluejay-validator performance optimization","metricName":"total_ns","metricUnit":"ns","bestDirection":"lower"}
{"run":1,"commit":"e595672","metric":38365,"metrics":{"validate_simple_ns":2904,"validate_fragments_ns":12263,"validate_complex_ns":23198,"fsm_128_ns":476158},"status":"keep","description":"Baseline: full validation pipeline (simple+fragments+complex)","timestamp":1773688287397,"segment":0}
{"run":2,"commit":"a3d9a64","metric":36384,"metrics":{"validate_simple_ns":2713,"validate_fragments_ns":11654,"validate_complex_ns":22017,"fsm_128_ns":435353},"status":"keep","description":"Replace HashSet with Vec for parent_fragments in FieldSelectionMerging (cheaper clone, linear scan for small N)","timestamp":1773688638980,"segment":0}
{"run":3,"commit":"c5e5d37","metric":33905,"metrics":{"validate_simple_ns":2341,"validate_fragments_ns":10774,"validate_complex_ns":20790,"fsm_128_ns":375920},"status":"keep","description":"Eliminate Path Vec allocation - members() never used by any rule, make Path Copy","timestamp":1773688752910,"segment":0}
{"run":4,"commit":"55b0a8b","metric":33366,"metrics":{"validate_simple_ns":2275,"validate_fragments_ns":10640,"validate_complex_ns":20451,"fsm_128_ns":379833},"status":"keep","description":"Replace HashSet with Vec in fragment_spreads_must_not_form_cycles cycle detection","timestamp":1773688868225,"segment":0}
{"run":5,"commit":"a85517b","metric":32432,"metrics":{"validate_simple_ns":2286,"validate_fragments_ns":10433,"validate_complex_ns":19713,"fsm_128_ns":377741},"status":"keep","description":"Refactor FieldSelectionMerging to use &mut Vec for error collection instead of returning intermediate Vecs","timestamp":1773688986346,"segment":0}
{"run":6,"commit":"f868983","metric":32079,"metrics":{"validate_simple_ns":2499,"validate_fragments_ns":9978,"validate_complex_ns":19602,"fsm_128_ns":399391},"status":"keep","description":"Eliminate HashSet allocation in FragmentSpreadIsPossible - use iterator-based overlap check with fast paths","timestamp":1773689107943,"segment":0}
{"run":7,"commit":"f868983","metric":33141,"metrics":{"validate_simple_ns":2495,"validate_fragments_ns":10652,"validate_complex_ns":19994,"fsm_128_ns":378286},"status":"discard","description":"Split cached_errors into HashMap validity_cache + BTreeMap errors — regression, extra HashMap overhead not worth it for small maps","timestamp":1773689489206,"segment":0}
{"run":8,"commit":"063faee","metric":30378,"metrics":{"validate_simple_ns":2177,"validate_fragments_ns":9496,"validate_complex_ns":18705,"fsm_128_ns":379119},"status":"keep","description":"Optimize duplicates() utility: skip BTreeMap allocation when no duplicates found (common case)","timestamp":1773689651344,"segment":0}
{"run":9,"commit":"1bdb79a","metric":29616,"metrics":{"validate_simple_ns":2039,"validate_fragments_ns":9442,"validate_complex_ns":18135,"fsm_128_ns":372824},"status":"keep","description":"Replace HashMap with linear scan in RequiredArguments - argument lists are small, avoid allocation","timestamp":1773689737703,"segment":0}
{"run":10,"commit":"1bdb79a","metric":30438,"metrics":{"validate_simple_ns":2036,"validate_fragments_ns":9730,"validate_complex_ns":18672,"fsm_128_ns":347882},"status":"discard","description":"Replace BTreeMap cached_errors with HashSet visited + Vec errors in FieldSelectionMerging — regression for small caches","timestamp":1773689933184,"segment":0}
{"run":11,"commit":"07bfd96","metric":29210,"metrics":{"validate_simple_ns":2043,"validate_fragments_ns":9358,"validate_complex_ns":17809,"fsm_128_ns":364433},"status":"keep","description":"Fast path in same_for_common_parents_by_name: skip HashMap grouping when all fields share same parent type","timestamp":1773690055103,"segment":0}
{"run":12,"commit":"a3512e5","metric":28437,"metrics":{"validate_simple_ns":2061,"validate_fragments_ns":8983,"validate_complex_ns":17393,"fsm_128_ns":366730},"status":"keep","description":"Optimize duplicates(): avoid intermediate (K,T) vec, compute key on-the-fly during dupe check","timestamp":1773690272576,"segment":0}
{"run":13,"commit":"06aee8f","metric":28230,"metrics":{"validate_simple_ns":2115,"validate_fragments_ns":9050,"validate_complex_ns":17065,"fsm_128_ns":359631},"status":"keep","description":"Replace 2x HashMap allocation in Arguments::equivalent with linear scan (bluejay-core) - O(n*m) faster for small N","timestamp":1773690624076,"segment":0}
{"run":14,"commit":"75e69c3","metric":27934,"metrics":{"validate_simple_ns":2056,"validate_fragments_ns":8855,"validate_complex_ns":17023,"fsm_128_ns":353549},"status":"keep","description":"Reuse Cache's fragment_definitions HashMap in FragmentSpreadTargetDefined instead of creating separate HashSet","timestamp":1773690923922,"segment":0}
{"run":15,"commit":"75e69c3","metric":28262,"metrics":{"validate_simple_ns":2055,"validate_fragments_ns":9115,"validate_complex_ns":17092,"fsm_128_ns":321280},"status":"discard","description":"Replace HashMap with Vec-based GroupedFields for field grouping — flat/regression on small queries, big win on fsm_128 (-9.1%)","timestamp":1773691303604,"segment":0}
{"run":16,"commit":"75e69c3","metric":32573,"metrics":{"validate_simple_ns":2040,"validate_fragments_ns":10583,"validate_complex_ns":19950,"fsm_128_ns":374353},"status":"discard","description":"Pre-allocate HashMap with_capacity(8) for grouped_fields — regression, over-allocates for small selection sets","timestamp":1773691406701,"segment":0}
{"run":17,"commit":"c38ec0b","metric":27714,"metrics":{"validate_simple_ns":2000,"validate_fragments_ns":8839,"validate_complex_ns":16875,"fsm_128_ns":357741},"status":"keep","description":"Add visit_unknown_field to Visitor trait — FieldSelections now uses orchestrator's existing get() instead of redundant contains_field scan","timestamp":1773691600547,"segment":0}
{"run":18,"commit":"91314e9","metric":27568,"metrics":{"validate_simple_ns":1979,"validate_fragments_ns":8805,"validate_complex_ns":16784,"fsm_128_ns":350281},"status":"keep","description":"Fix unused import warning in field_selections.rs","timestamp":1773691701593,"segment":0}
{"run":19,"commit":"91314e9","metric":27735,"metrics":{"validate_simple_ns":2040,"validate_fragments_ns":8792,"validate_complex_ns":16903,"fsm_128_ns":347683},"status":"discard","description":"Hoist fields_definition() call outside selection loop — no measurable change, compiler already optimizes this","timestamp":1773691791338,"segment":0}
{"run":20,"commit":"f468339","metric":27728,"metrics":{"validate_simple_ns":2020,"validate_fragments_ns":9086,"validate_complex_ns":16622,"fsm_128_ns":359677},"status":"discard","description":"Add #[inline] hints to hot trait methods in bluejay-core — no measurable change, compiler already inlines","timestamp":1773691935071,"segment":0}
{"run":21,"commit":"f468339","metric":27155,"metrics":{"validate_simple_ns":1934,"validate_fragments_ns":8885,"validate_complex_ns":16336,"fsm_128_ns":355882},"status":"discard","description":"Re-run to confirm stability — no code changes, just benchmark noise (27.2k-27.7k range)","timestamp":1773692042538,"segment":0}
{"run":22,"commit":"f468339","metric":28420,"metrics":{"validate_simple_ns":2018,"validate_fragments_ns":9046,"validate_complex_ns":17356,"fsm_128_ns":364574},"status":"discard","description":"Separate HashSet for cycle detection in FieldSelectionMerging — extra HashSet overhead not worth avoiding sentinel BTreeMap insert","timestamp":1773692154324,"segment":0}
{"run":23,"commit":"0686bb9","metric":28416,"metrics":{"validate_simple_ns":2090,"validate_fragments_ns":9025,"validate_complex_ns":17301,"fsm_128_ns":368595},"status":"discard","description":"Stability check — no code changes, confirming ~27.5-28.4k range is stable","timestamp":1773692281251,"segment":0}
{"run":24,"commit":"9a102f3","metric":27640,"metrics":{"validate_simple_ns":1980,"validate_fragments_ns":8822,"validate_complex_ns":16838,"fsm_128_ns":354518},"status":"keep","description":"Fix: restore clean field_selection_merging.rs (discard artifacts from HashSet cycle detection experiment leaked into doc commits)","timestamp":1773692505491,"segment":0}
{"run":25,"commit":"8113d0f","metric":27542,"metrics":{"validate_simple_ns":1994,"validate_fragments_ns":8887,"validate_complex_ns":16661,"fsm_128_ns":336285},"status":"keep","description":"Use Rc<Vec> for parent_fragments in FieldContext — share across fields in same fragment scope, avoid per-field to_vec() allocation","timestamp":1773692814008,"segment":0}
